691987,Достоевский Ф. М.,Бесы,https://moscowbooks.ru/image/book/434/w259/i434489.jpg,0,,True,200 руб.,"Роман ""Бесы"" Ф. М. Достоевского — одно из величайших достижений мировой культуры — точно и глубоко обозначивший разломы грядущих социальных катастроф. Первая мировая война, русская революция, глобальная катастрофа Второй мировой и наши дни, подтвердили его пророчества о том, что ждет общество, отменившее веками существовавшие нравственные основания на которых оно и стоит. В этом шатком состоянии люди теряют способность различать добро и зло. Попытки радикального переустройства общества, духовная и нравственная слепота, ведут к катастрофе и безумию. Каждый раз из тектонических сдвигов истории, словно джинн из лампы, бесы приходят в мир, обещая помощь в исполнение якобы великих свершений, в реальности ими же порождённых, человеческих прихотей. И, вместе с тем, надежда, выраженная в эпиграфе романа: "" вышли жители смотреть случившееся и, пришедшие к Иисусу, нашли человека, из которого вышли бесы, сидящего у ног Иисусовых, одетого и в здравом уме, и ужаснулись"". Каждый, прочитавший это произведение, получает прививку от бездумного следования за очередными губительными лозунгами.",Эксмо,2013,Москва,русский,Мягкая обложка,76х100 1/32,180x115,375 гр.,768,4000 экз.,691987,ITD000000000201818,978-5-699-57660-9,26.07.2013,,,,,,,,,,,,
673755,Достоевский Ф. М.,Записки из Мертвого дома,https://moscowbooks.ru/image/book/422/w259/i422720.jpg,0,,True,128 руб.,"""Записки из Мёртвого дома"" — одна из вершин творческого наследия Ф. М. Достоевского — основаны на жизненной истории: это ужасные воспоминания Достоевского, приговорённого сначала к расстрелу за участие в революционном кружке, но вместо смертной казни сосланного в Омский острог, где он пробыл с 1850 до 1854 года, всё это время закованный в кандалы и в соседстве с каторжниками. Вспоминания это соседство, писатель говорит: ""Ничего нет ужаснее, как жить не в своей среде..."" С другой стороны, эти четыре года не в своей среде развили литературные способности Достоевского: в лучших романах, появившихся после ""Мёртвого дома"", чувствуется, что никто другой не умеет с такой силой передать трагичность тех или иных людских переживаний и отношений. Лев Толстой, ревниво следивший за творчеством современных ему литераторов, как-то признался, перечитав ""Мёртвый дом"": ""Я не знаю лучше книги изо всей новой литературы, включая Пушкина"".",Азбука-Аттикус; Авалонъ,2013,СПб,русский,Мягкая обложка,76х100 1/32,180x115,185 гр.,384,3000 экз.,673755,А0000004425,978-5-389-05533-9,26.03.2013,,,,,,,,,,,,
654218,Достоевский Ф. М.,Преступление и наказание,https://moscowbooks.ru/image/book/410/w259/i410286.jpg,0,,True,144 руб.,"Одно из ""краеугольных"" произведений русской и мировой литературы, включенный во все школьные и университетские программы, неоднократно экранизированный роман Достоевского ""Преступление и наказание"" ставит перед читателем важнейшие нравственно-мировоззренческие вопросы — о вере, совести, грехе и об искуплении через страдание. Опровержение преступной ""идеи-страсти"", ""безобразной мечты"", завладевшей умом Родиона Раскольникова в самом ""умышленном"" и ""фантастическом"" городе на свете, составляет основное содержание этой сложнейшей, соединившей в себе несколько различных жанров книги. Задуманный как ""психологический отчет одного преступления"", роман Достоевского предстал перед читателем грандиозным художественно-философским исследованием человеческой природы, христианской трагедией о смерти и воскресении души.",Азбука; Азбука-Аттикус,2013,СПб,русский,Твердый переплет,84х108 1/32,200x130,430 гр.,608,15000 экз.,654218,А0000003840,978-5-389-04926-0,22.11.2012,,,,,,,,,,,,
649639,Достоевский Ф. М.,Идиот,https://moscowbooks.ru/image/book/407/w259/i407645.jpg,0,,True,144 руб.,"""Главная идея... — писал Ф. М. Достоевский о своем романе ""Идиот"", — изобразить положительно-прекрасного человека. Труднее этого нет ничего на свете…"" Не для того ли писатель явил миру ""князя-Христа"", чтобы мы не забывали: ""Страдание есть главнейший и, может быть, единственный закон бытия всего человечества"".Каждое новое поколение по-своему воспринимает классику и пытается дать собственные ответы на вечные вопросы бытия. Об этом свидетельствуют и известные экранизации романа, его сценические версии. В России запоминающиеся образы князя Мышкина создали Ю. Яковлев, И. Смоктуновский, Е. Миронов.",Азбука; Азбука-Аттикус,2012,СПб,русский,Твердый переплет,84х108 1/32,200x130,445 гр.,640,15000 экз.,649639,А0000003474,978-5-389-04730-3,26.10.2012,,,,,,,,,,,,
624863,Достоевский Ф. М.,Белые ночи. 4 уровень. 9-е издание,https://moscowbooks.ru/image/book/392/w259/i392601.jpg,0,,True,216 руб.,"Вашему вниманию предлагается книга из серии ""Библиотека Златоуста"". Серия включает адаптированные тексты для 5 уровней владения русским языком: произведения классиков русской литературы, современных писателей, публицистов, журналистов, а также киносценарии. Уровни ориентируются на лексические минимумы, разработанные для Российской государственной системы тестирования по русскому языку. Каждый выпуск снабжен вопросами, заданиями и словарем, в который вошли слова, выходящие за пределы минимума.",Златоуст,2012,СПб,русский,Мягкая обложка,60х90 1/16,215x145,85 гр.,72,1000 экз.,624863,9785865475552,978-5-86547-555-2,17.05.2012,,,,,,,,,,,,
585315,Достоевский Ф. М.,Униженные и оскорбленные,https://moscowbooks.ru/image/book/368/w259/i368479.jpg,0,,True,120 руб.,"Роман «Униженные и оскорбленные» (1861) создавался Ф.М. Достоевским в эпоху необычайного подъема русской общественной жизни — в эпоху, когда публикация нового литературного произведения воспринималась как событие социально значимое. Так было воспринято и появление романа «Униженные и оскорбленные». После его выхода в свет Н. А. Добролюбов отвел Достоевскому самое почетное место в «гуманистическом» направлении русской литературы. Многое в этом романе читателям казалось необычным: перед ними была поставлена новая этико-социальная проблема — проблема эгоизма. Князь Валковский, разворачивающий на страницах романа свою циническую «философию жизни», стал первым в творчестве писателя героем-«идеологом», предшественником Человека из подполья, Раскольникова, Свидригайлова и других героев Достоевского 1860—1870-х гг.",Азбука; Азбука-Аттикус,2013,СПб,русский,Мягкая обложка,76х100 1/32,180x115,210 гр.,432,3000 экз.,585315,А0000000470,978-5-389-02646-9,29.09.2011,,,,,,,,,,,,
584603,Достоевский Ф. М.,Дневник писателя,https://moscowbooks.ru/image/book/368/w259/i368008.jpg,0,,True,144 руб.,"Знал ли Достоевский, когда создавал свой ""Дневник писателя"", что это будет произведение, актуальное на все времена?""Дневник писателя"" вобрал в себя разнообразный материал: политические статьи, судебные очерки, исторические размышления, судебные заметки, литературную критику, автобиографическую прозу. Эту книгу можно было бы назвать — ""Русский вопрос в конце XIX века"". Эта книга, отвечающая на многие ""проклятые"" вопросы, принесла Достоевскому общероссийскую славу и сделала его кумиром многих поколений.",Азбука; Азбука-Аттикус,2011,СПб,русский,Мягкая обложка,76х100 1/32,180x115,230 гр.,464,5000 экз.,584603,А0000000581,978-5-389-02806-7,26.09.2011,,,,,,,,,,,,
574915,Достоевский Ф. М.,Записки из подполья,https://moscowbooks.ru/image/book/361/w259/i361870.jpg,0,,True,120 руб.,"""Записки из подполья"" — увертюра Достоевского к его пятикнижию; в повести нашли свое выражение великие прозрения художника-мыслителя; здесь впервые в русской литературе сформулированы основы философии экзистенциализма. ""Записки из подполья"" — повесть точно поставленных вопросов и точно найденных интонаций. Боль пронизывает слово героя, оно бьется в стремительных перепадах его настроений, в бесконечных волнениях, в тягостных переживаниях и в неразрешимых тупиках.",Азбука; Азбука-Аттикус,2011,СПб,русский,Мягкая обложка,76х100 1/32,180x115,130 гр.,256,5000 экз.,574915,00000018093,978-5-389-02280-5,25.07.2011,,,,,,,,,,,,
541743,Достоевский Ф. М.,Бесы,https://moscowbooks.ru/image/book/339/w259/i339583.jpg,0,,True,168 руб.,"Уже были написаны «Записки из Мертвого дома», «Записки из подполья», «Преступление и наказание», «Идиот», а Достоевский все еще испытывал острое чувство неудовлетворенности и, по собственному признанию, только подбирался к главному своему произведению, перед которым вся «прежняя литературная карьера была только дрянь и введение». Однако в политической жизни России случилось нечто, заставившее Достоевского изменить свои литературные планы и приступить к созданию романа с вызывающим и символичным названием «Бесы». Спиралеобразное развитие истории вообще и российской истории в частности позволяет думать, что роман Достоевского «Бесы» будет интересен новым поколениям читателей не только как шедевр классической литературы.",Азбука; Азбука-Аттикус,2011,СПб,русский,Мягкая обложка,76х100 1/32,180x115,340 гр.,704,7000 экз.,541743,00000017410,978-5-389-01464-0,22.12.2010,,,,,,,,,,,,
539813,Достоевский Ф. М.,Игрок,https://moscowbooks.ru/image/book/338/w259/i338405.jpg,0,,True,112 руб.,"Роман «Игрок» занимает в творчестве Ф. М. Достоевского особое место — в нем исключительно сильны автобиографические мотивы: многолетнее увлечение писателя игрой в рулетку и сложные, мучительные взаимоотношения с А. П. Сусловой. Замысел «Игрока» возник еще в 1863 г. Осенью 1865 г., испытывая финансовые трудности, Достоевский всего за 26 дней надиктовал текст романа своей стенографистке А. Г. Сниткиной (ставшей впоследствии его женой). По ее воспоминаниям, когда в процессе работы над романом обсуждались судьбы героев, то «Федор Михайлович был вполне на стороне ""игрока"" и говорил, что многое из его чувств и впечатлений испытал сам на себе. Уверял, что можно обладать сильным характером, доказать это своею жизнью и тем не менее не иметь сил побороть в себе страсть к игре на рулетке».",Азбука; Азбука-Аттикус,2013,СПб,русский,Мягкая обложка,76х100 1/32,180x115,115 гр.,224,3000 экз.,539813,00000017376,978-5-389-01465-7,13.12.2010,,,,,,,,,,,,
537526,Достоевский Ф. М.,Записки из мертвого дома,https://moscowbooks.ru/image/book/336/w259/i336786.jpg,0,,True,18 900 руб.,"""Записки из Мертвого дома"" (1860—1862) — одно из наиболее значительных и своеобразных произведений русской литературы 1860-х годов и одновременно одна из вершин творческого наследия Ф.М. Достоевского. В нем отражены впечатления пережитого и увиденного автором в Сибири, в омском остроге, где он провел четыре года, осужденный по делу петрашевцев. Этот уникальный литературный документ, жанровую природу которого часто характеризуют как ""художественные мемуары"", содержит рассказы о судьбах реальных заключенных, которых писатель встречал на каторге. В то же время это художественное произведение, важнейшая философская проблематика которого задана в развернутых метафорах Мертвого дома и воскресения. Книга сопровождается статьей и примечаниями Б.Н. Тихомирова, написанными специально для этого издания. Также впервые публикуется цикл иллюстраций, созданный замечательным графиком, членом-корреспондентом Российской академии художеств Б.Л. Непомнящим.",,2010,СПб,русский,Кожаный переплет,70х100 1/16,240x170,1050 гр.,504,1200 экз.,537526,,978-5-93898-307-6,30.11.2010,,Углубленное тиснение (красочное плоскоуглубленное изображение),Мелованная,Золотой,Непомнящий Б. Л.,,,Вставной,,,,
534806,Достоевский Ф. М.,Чужая жена и муж под кроватью,https://moscowbooks.ru/image/book/335/w259/i335093.jpg,0,,True,128 руб.,"В книге объединены произведения Достоевского, написанные им в начале литературного пути: ""Роман в девяти письмах"", ""Чужая жена и муж под кроватью"", ""Дядюшкин сон"", ""Скверный анекдот"", ""Крокодил"". В них довольно сложно угадать будущего автора ""великого пятикнижия"", перед нами — ""веселый"" Достоевский, обнаруживающий талант сатирика и юмориста, который позднее лишь отдельными искорками высветится в его знаменитых романах.",Азбука; Азбука-Аттикус,2011,СПб,русский,Мягкая обложка,76х100 1/32,180x115,180 гр.,368,5000 экз.,534806,00000017170,978-5-389-01367-4,15.11.2010,,,,,,,,,,,,
528178,Достоевский Ф. М.,Белые ночи,https://moscowbooks.ru/image/book/330/w259/i330613.jpg,0,,True,128 руб.,"В истории мирового романа Ф. М. Достоевскому принадлежит одно из первых мест. Его творчество обогатило опыт художественного самопознания человечества. Он автор знаменитых романов «Преступление и наказание», «Униженные и оскорбленные», «Идиот», «Братья Карамазовы», «Игрок»... В настоящем издании представлены ранние повести Достоевского: «Белые ночи» (1848) и «Неточка Незванова» (1849—1860). Если в первом произведении (романе влюбленных) поднимается столь своевременная и сегодня проблема отчужденности личности, то во втором ставится вопрос: изначально ли жестока человеческая натура. Можно смело сказать, что «Белые ночи» и «Неточка Незванова» — самые поэтичные произведения Достоевского. Книгу завершают эссе И. Анненского о Достоевском.",Азбука; Азбука-Аттикус,2014,СПб,русский,Мягкая обложка,76х100 1/32,180x115,165 гр.,320,3000 экз.,528178,00000016946,978-5-389-01212-7,01.10.2010,,,,,,,,,,,,
462213,Достоевский Ф. М.,Идиот. Бедные люди. 1 CD: mp3,https://moscowbooks.ru/image/book/285/w259/i285257.jpg,0,,True,192 руб.,"""Известность к Иннокентию Смоктуновскому пришла после того, как он сыграл князя Мышкина в спектакле по роману Ф. М. Достоевского ""Идиот"" в постановке Ленинградского Большого драматического театра.Роль Мышкина стала переломной в судьбе актера. Он сознавался, что его жизнь делится на две половины: до ""Идиота"" и после него, что не было еще такой же роли, которая позволила бы ему более полно выразить свой талант.Произведения Достоевского в исполнении Иннокентия Смоктуновского выстраданы, прочувствованы, продуманы. Актеру удается быть одновременно лириком и психологом, глубоко проникнуть во внутренний мир, передать неуловимые нюансы состояния души героев Достоевского.Читает: Иннокентий Смоктуновский.Время звучания: 6 ч. 22 мин.",,,,русский,,,,60 гр.,,,462213,67502,4607031755907,25.05.2009,,,,,,,,,Ардис,2009,Москва,
438062,Достоевский Ф. М.,Преступление и наказание. В 2 томах,https://moscowbooks.ru/image/book/268/w259/i268485.jpg,0,,True,8 593 руб.,"Огромная сила образов, созданных великим писателем, блестяще передана в многочисленных иллюстрациях художника Олега Евсеева, публикуемых впервые. Великолепный переплет с оригинальным тиснением 6-ю цветами фольги и подложка с видами Петербурга Достоевского достойно завершают оформление издания.",,2008,Москва,русский,Твердый переплет с золотым обрезом,140х207 мм,207x140,1990 гр.,1094,1500 экз.,438062,,"978-5-7827-0112-3,978-5-7827-0114-7",24.11.2008,,,,,,,,,,,,
423362,Достоевский Ф. М.,Идиот,https://moscowbooks.ru/image/book/257/w259/i257608.jpg,0,,True,420 руб.,"Роман, в котором творческие принципы Достоевского воплощаются в полной мере, а удивительное владение сюжетом достигает подлинного расцвета. Яркая и почти болезненно талантливая история несчастного князя Мышкина, неистового Парфена Рогожина и отчаявшейся Настасьи Филипповны, много раз экранизированная и поставленная на сцене, и сейчас завораживает читателя...",Эксмо,2009,Москва,русский,Твердый переплет+суперобложка,84х108 1/32,200x130,610 гр.,800,4000 экз.,423362,430000000000003174,978-5-699-30026-6,15.08.2008,,,,,,,,,,,,
