Код товара,Автор,Название,Обложка,Рейтинг,Стикеры,Наличие,Цена,Описание,Издательство:,Год издания:,Место издания:,Язык текста:,Тип обложки:,Формат:,Размеры в мм (ДхШхВ):,Вес:,Страниц:,Тираж:,Код товара:,Артикул:,ISBN:,В продаже с:,Возраст:,Тиснение:,Бумага:,Обрез:,Иллюстрации:,Язык оригинала:,Перевод:,Футляр:,Производитель:,Год производства:,Место производства:,Иллюстраторы:
1012089,Достоевский Ф. М.,Преступление и наказание,https://moscowbooks.ru/image/book/675/w259/i675194.jpg,0,,True,136 руб.,"""Преступление и наказание"" — высочайший образец криминального романа. В рамках жанра полицейского расследования писатель поставил вопросы, и по сей день не решенные. Кем должен быть человек: ""тварью дрожащей"", как говорит Раскольников, или ""Наполеоном""? И это проблема уже XXI века. Написанный в 1866 году роман ""Преступление и наказание"" до сих пор остается самой читаемой в мире книгой и входит в большинство школьных программ по литературе.",Эксмо,2019,Москва,русский,Твердый переплет,84х108 1/32,200x130x28,425 гр.,592,7000 экз.,1012089,ITD000000000832998,978-5-699-93016-6,11.10.2019,,,,,,,,,,,,
1004205,Достоевский Ф. М.,Игрок,https://moscowbooks.ru/image/book/668/w259/i668202.jpg,0,,False,220 руб.,"В романе ""Игрок"" писатель изображает прекрасного человека, который не вписывается в общество, где царят бездушие и лицемерие.",Искателькнига,2015,Москва,русский,Твердый переплет,60х90 1/16,215x145,227 гр.,126,3000 экз.,1004205,,978-5-9905833-4-4,27.08.2019,16 +,,,,,,,,,,,
1000435,Достоевский Ф. М.,Чужая жена и муж под кроватью,https://moscowbooks.ru/image/book/664/w259/i664507.jpg,0,,True,144 руб.,"Очень необычный сборник. Очень непривычный Достоевский. Достоевский не только (и не столько) трагический, но — ироничный, веселый, трогательный и даже сентиментальный. Достоевский ""малой формы"" — мастер злободневных сюжетов, комических ситуаций и остроумных диалогов. Достоевский в начале своего литературного пути — до ""Великого пятикнижия"". ""Село Степанчиково и его обитатели"", ""Хозяйка"", ""Чужая жена и муж под кроватью"" — без этих произведений невозможно понять Достоевского. Ведь именно в них наметились те философско-нравственные и социально-психологические мотивы творчества, из которых позже вырастут ""Братья Карамазовы"", ""Идиот"", ""Бесы"" и другие романы.",АСТ,2019,Москва,русский,Мягкая обложка,76х100 1/32,180x115x27,240 гр.,384,5000 экз.,1000435,ASE000000000843846,978-5-17-115705-0,30.07.2019,,,,,,,,,,,,
997191,Достоевский Ф. М.,Полное собрание романов в двух томах. В 2 книгах,https://moscowbooks.ru/image/book/661/w259/i661044.jpg,0,,True,1 880 руб.,"В первый том вошли романы ""Бедные люди"", ""Игрок"", ""Идиот"", ""Бесы"", ""Униженные и оскорбленные"", а в Приложение — рассказ ""Роман в девяти письмах"" и повесть ""Белые ночи. Сентиментальный роман"".Во второй том вошли романы ""Подросток"", "" Преступление и наказание "", ""Братья Карамазовы"".",АЛЬФА-КНИГА,2019,Москва,русский,Твердый переплет,60х90 1/16,215x145x115,2445 гр.,2558,3000 экз.,997191,188881,978-5-9922-0332-5,08.07.2019,,,,,,,,,,,,
995794,Достоевский Ф. М.,Преступление и наказание,https://moscowbooks.ru/image/book/659/w259/i659553.jpg,0,,True,12 654 руб.,"""Преступление и наказание"" — одно из самых известных, цельных и глубоких произведений Достоевского. Текст этой драмы был впервые опубликован в журнальном варианте в 1866 году, а год спустя вышел отдельной книгой. Любопытно, что роман сразу привлек к себе внимание не только всей читающей российской публики, но и зарубежных криминалистов, которые восхищались тончайшим анализом психологии преступника, описанной в этом произведении.Данное издание романа завершает небольшой очерк, посвященный творчеству Достоевского.Иллюстрации к роману, хорошо передающие и городскую атмосферу Петербурга последней трети XIX века, и сложный мир персонажей драмы, выполнены Ольгой Андреевной Русаковой.",,2019,СПб,русский,Кожаный переплет,,241x175x45,1100 гр.,432,,995794,,978-5-9603-0470-2,27.06.2019,,Углубленное тиснение (красочное плоскоуглубленное изображение),Офсетная,Рисованный,С иллюстрациями,,,,,,,
994923,Достоевский Ф. М.,Село Степанчиково и его обитатели. Из записок неизвестного,https://moscowbooks.ru/image/book/658/w259/i658853.jpg,0,,True,778 руб.,"В своей повести ""Село Степанчиково и его обитатели"" Ф. М. Достоевский разыгрывает на русский манер пьесу Мольера ""Тартюф"". Несмотря на то, что произведение создано в XIX веке, оно не теряет своей актуальности и по сей день.",Издательский дом Мещерякова,2019,Москва,русский,Твердый переплет,60х84 1/16,200x145x22,560 гр.,296,1500 экз.,994923,IDM00006739,978-5-00108-509-6,21.06.2019,10 +,,,,,,,,,,,
992455,Достоевский Ф. М.,Собрание сочинений. В 10 томах,https://moscowbooks.ru/image/book/656/w259/i656673.jpg,0,,True,6 400 руб.,"Федор Михайлович Достоевский (1821—1881) — великий русский писатель, мастер художественного слова, глубокий психолог и знаток человеческой души. Его творчество сильно повлияло на мировую художественную литературу и шире — мировую культуру. В собрании сочинений представлены все основные произведения писателя, а также ""Дневник писателя"", в котором Федор Михайлович отразил свои мысли о современных ему событиях.По сравнению с десятитомником 2010 года, в настоящее издание добавлены пропущенные месяцы ""Дневника писателя"".",Книжный Клуб Книговек,2019,Москва,русский,Твердый переплет,84х108 1/32,200x130x345,6960 гр.,,,992455,СМ017429,978-5-4224-1537-3,30.05.2019,,,,,,,,,,,,
989763,Достоевский Ф. М.,Малая проза. Книга 2. Скверный анекдот. Крокодил. Вечный муж. Бобок,https://moscowbooks.ru/image/book/654/w259/i654875.jpg,0,,True,4 880 руб.,"Настоящее издание ""малой прозы"" Ф. М. Достоевского (1821—1881) включает произведения 1860—1870-х годов.Вошедшие в него шесть рассказов и повесть демонстрируют широчайший творческий диапазон писателя: от утонченного психологизма рассказов ""Вечный муж"" и ""Кроткая"" до фантастического абсурда фельетона ""Тритон"". Открывающий книгу рассказ ""Скверный анекдот"" — подчеркнуто экспериментальный, обозначающий новые пути для прозы Достоевского. Фантастические рассказы ""Бобок"" и ""Сон смешного человека"" объединены масштабной религиозно-философской проблематикой, но различны по колориту — если в ""Бобке"" перед нами мрачный юмор, то в ""Сне смешного человека"" — патетическая серьезность. К фантастическим можно отнести и комическую сценку ""Крокодил"", однако аллюзии на политическую злобу дня отличают ее от прочих произведений.Тексты сопровождаются статьей и комментариями известного специалиста по творчеству Достоевского Б. Н. Тихомирова и иллюстрациями А. А. Джигирей, созданными специально для настоящего издания. Это вторая книга из задуманного издательством ""Вита Нова"" трехчастного собрания повестей и рассказов Достоевского разных лет (составитель — Б. Н. Тихомиров).",,2019,СПб,русский,Твердый переплет,70х100 1/16,240x170x40,1510 гр.,536,800 экз.,989763,,978-5-93898-696-1,15.05.2019,,,,,,,,,,,,
988509,Достоевский Ф. М.,Братья Карамазовы,https://moscowbooks.ru/image/book/653/w259/i653792.jpg,0,,True,6 318 руб.,"«Братья Карамазовы» (1879–1880), последний, самый объемный и один из наиболее известных романов Ф. М. Достоевского, обращают читателя к вневременным нравственно-философским вопросам о грехе, воздаянии, сострадании и милосердии. Книга, которую сам писатель определил как «роман о богохульстве и опровержении его», явилась попыткой «решить вопрос о человеке», «разгадать тайну» человека, что, по Достоевскому, означало «решить вопрос о Боге». Сквозь призму почти детективной истории о жестоком убийстве главы провинциальной семьи Карамазовых автор повествует об извечной борьбе Божественного и дьявольского в человеческой душе. Один из самых глубоких в мировой литературе опытов отражения христианского сознания, «Братья Карамазовы» стали в XX веке объектом парадоксальных философских и психоаналитических интерпретаций.Ограниченный тираж.",,2019,СПб,русский,Кожаный переплет,60х90 1/16,215x145x45,960 гр.,832,,988509,978-5-389-15519-0,,30.04.2019,,Углубленное тиснение (красочное плоскоуглубленное изображение),Офсетная,Рисованный,,,,,,,,
987119,Достоевский Ф. М.,Преступление и наказание,https://moscowbooks.ru/image/book/652/w259/i652738.jpg,0,,True,630 руб.,"""Преступление и наказание"" — одно из самых известных, цельных и глубоких произведений Достоевского. Текст этой драмы был впервые опубликован в журнальном варианте в 1866 году, а год спустя вышел отдельной книгой. Любопытно, что роман сразу привлек к себе внимание не только всей читающей российской публики, но и зарубежных криминалистов, которые восхищались тончайшим анализом психологии преступника, описанной в этом произведении.Данное издание романа завершает небольшой очерк, посвященный творчеству Достоевского.Иллюстрации к роману, хорошо передающие и городскую атмосферу Петербурга последней трети XIX века, и сложный мир персонажей драмы, выполнены Ольгой Андреевной Русаковой.",СЗКЭО,2019,СПб,русский,Твердый переплет,,241x175x41,990 гр.,432,3000 экз.,987119,ББ29279,978-5-9603-0470-2,22.04.2019,,,,,,,,,,,,
982096,Достоевский Ф. М.,Дневник писателя,https://moscowbooks.ru/image/book/150/w259/i150372.jpg,0,,True,88 руб.,"В книге содержатся отрывки и афоризмы из ""Дневника писателя"", которые раскрывают мировоззрение Ф.М. Достоевского, его общественно-политические взгляды на Россию и Европу. Здесь же представлены мысли писателя о величии национального духа, родного языка и русской культуры. Книга выполнена в миниварианте.",Янтарный сказ,2005,Калининград,русский,Твердый переплет,70х90 1/64,,75 гр.,144,5000 экз.,982096,,5-7406-0937-5,19.03.2019,,,,,,,,,,,,
981645,Достоевский Ф. М.,Братья Карамазовы,https://moscowbooks.ru/image/book/648/w259/i648456.jpg,0,,True,403 руб.,"""Братья Карамазовы"" — итоговый роман Ф.М. Достоевского, в нем сконцентрировались вся художественная мощь писателя и глубина прозрений религиозного мыслителя. ""Братья Карамазовы"" — это итоговое произведение, в котором испепеляющая страсть, борьба за наследство, богоискательство выводят на глобальные вопросы о самой сущности человека, о его природе. Каждый характер, как бы сложен он ни был, у Достоевского предстает некой частью одной, почти безграничной картины — это картина многогранной человеческой души, и в этой душе, и за эту душу идет нескончаемая битва добра и зла.",Эксмо,2019,Москва,русский,Твердый переплет+суперобложка,84х108 1/32,200x130x45,730 гр.,896,3000 экз.,981645,ITD000000000953061,978-5-04-100921-2,15.03.2019,,,,,,,,,,,,
980091,Достоевский Ф. М.,Братья Карамазовы,https://moscowbooks.ru/image/book/647/w259/i647201.jpg,0,,True,487 руб.,"«Братья Карамазовы» (1879–1880), последний, самый объемный и один из наиболее известных романов Ф. М. Достоевского, обращают читателя к вневременным нравственно-философским вопросам о грехе, воздаянии, сострадании и милосердии. Книга, которую сам писатель определил как «роман о богохульстве и опровержении его», явилась попыткой «решить вопрос о человеке», «разгадать тайну» человека, что, по Достоевскому, означало «решить вопрос о Боге». Сквозь призму почти детективной истории о жестоком убийстве главы провинциальной семьи Карамазовых автор повествует об извечной борьбе Божественного и дьявольского в человеческой душе. Один из самых глубоких в мировой литературе опытов отражения христианского сознания, «Братья Карамазовы» стали в XX веке объектом парадоксальных философских и психоаналитических интерпретаций.",Азбука; Азбука-Аттикус,2019,СПб,русский,Твердый переплет,60х90 1/16,215x145x39,850 гр.,832,3000 экз.,980091,А0000017071,978-5-389-15519-0,04.03.2019,,,,,,,,,,,,
964356,Достоевский Ф. М.,Малое собрание сочинений,https://moscowbooks.ru/image/book/634/w259/i634232.jpg,0,,True,6 318 руб.,"О великом русском писателе Ф. М. Достоевском уже полтора века говорят не только литературоведы, но и философы, культурологи и социологи, в его богословских идеях находят что-то близкое для себя православные, католики и протестанты... Достоевский был ницшеанцем до Ницше, экзистенциалистом до Сартра, фрейдистом до Фрейда — спектр философских идей у него необычайно широк! Это тем более удивительно, что за всю жизнь Достоевский не создал ни одного философского или богословского трактата и материал для суждений берется именно из его романов и повестей. Мировую славу писателя определили пять романов: «Преступление и наказание», «Идиот», «Бесы», «Подросток», «Братья Карамазовы». Но не менее интересны и другие романы и повести — первооснова так называемого Великого Пятикнижия Достоевского, его идеологическая подготовка, источник ставших впоследствии устойчивыми мотивов и образов... Такие произведения и представлены в настоящем издании. Вниманию читателей предлагаются «Двойник», «Белые ночи», «Неточка Незванова», «Униженные и оскорбленные» и «Записки из подполья» — произведения, положившие начало мучительным раздумьям Достоевского над «тайной человека» и важнейшими для человечества вопросами. Вариации историй о бедном чиновнике, трагедия нищеты, вырастающая в трагедию оскорбленного достоинства; раздвоенность личности и черты угнетателя, проступающие в угнетенном; дисгармония ума и чувства; идея «хрустального дворца», грядущего рая и страдания тех, кто станет лишь «материалом» для него, — все это на фоне Петербурга, по-достоевски прозаического и одновременно призрачного…Ограниченный тираж.",,2018,СПб,русский,Кожаный переплет,60х90 1/16,215x145x50,900 гр.,800,,964356,,,27.11.2018,,Углубленное тиснение (красочное плоскоуглубленное изображение),Офсетная,Рисованный,,,,,,,,
956575,Достоевский Ф. М.,Идиот,https://moscowbooks.ru/image/book/627/w259/i627395.jpg,0,,False,250 руб.,"Ф.М. Достоевский (1821-1881) – русский  писатель, чье творчество оказало существенное влияние не только на русскую, но и на мировую культуру.	В. Г. Белинский считал, что ""его талант принадлежит к разряду тех, которые постигаются и признаются не вдруг. Много, в продолжение его поприща, явится талантов, которых будут противопоставлять ему, но кончится тем, что о них забудут именно в то время, когда он достигнет апогея своей славы"".	Достоевский писал: ""Давно уже мучила меня одна мысль, но я боялся из неё сделать роман, потому что мысль слишком трудная и я к ней не приготовлен, хотя мысль вполне соблазнительная и я люблю её. Идея эта — изобразить вполне прекрасного человека. Труднее этого, по-моему, быть ничего не может, в наше время особенно"".	Двадцатишестилетний князь Лев Николаевич Мышкин возвращается в Россию из санатория в Швейцарии, где провёл на лечении несколько лет.",АСТ,2018,Москва,русский,Твердый переплет,84х108 1/32,,,640,3000 экз.,956575,ASE000000000838465,"978-5-17-110413-9,978-5-17-110415-3",05.11.2018,12 +,,,,,,,,,,,
